15:51:20.564222 IP (tos 0x0, ttl 64, id 0, offset 0, flags [DF], proto TCP (6), length 64, bad cksum 0 (->e4ae)!)
    192.168.106.92.51775 > 192.168.106.92.9042: Flags [S], cksum 0x563c (incorrect -> 0xc414), seq 770041575, win 65535, options [mss 16344,nop,wscale 6,nop,nop,TS val 1529709869 ecr 0,sackOK,eol], length 0
E..@..@.@.....j\..j\.?#R-...........V<....?........
[-.-........
15:51:20.564241 IP (tos 0x0, ttl 64, id 0, offset 0, flags [DF], proto TCP (6), length 64, bad cksum 0 (->e4ae)!)
    192.168.106.92.51775 > 192.168.106.92.9042: Flags [S], cksum 0x563c (incorrect -> 0xc414), seq 770041575, win 65535, options [mss 16344,nop,wscale 6,nop,nop,TS val 1529709869 ecr 0,sackOK,eol], length 0
E..@..@.@.....j\..j\.?#R-...........V<....?........
[-.-........
15:51:20.564409 IP (tos 0x0, ttl 64, id 0, offset 0, flags [DF], proto TCP (6), length 64, bad cksum 0 (->e4ae)!)
    192.168.106.92.9042 > 192.168.106.92.51775: Flags [S.], cksum 0x563c (incorrect -> 0xc2f7), seq 1683881980, ack 770041576, win 65535, options [mss 16344,nop,wscale 6,nop,nop,TS val 1907305218 ecr 1529709869,sackOK,eol], length 0
E..@..@.@.....j\..j\#R.?d]..-.......V<....?........
q.+.[-.-....
15:51:20.564417 IP (tos 0x0, ttl 64, id 0, offset 0, flags [DF], proto TCP (6), length 64, bad cksum 0 (->e4ae)!)
    192.168.106.92.9042 > 192.168.106.92.51775: Flags [S.], cksum 0x563c (incorrect -> 0xc2f7), seq 1683881980, ack 770041576, win 65535, options [mss 16344,nop,wscale 6,nop,nop,TS val 1907305218 ecr 1529709869,sackOK,eol], length 0
E..@..@.@.....j\..j\#R.?d]..-.......V<....?........
q.+.[-.-....
15:51:20.564439 IP (tos 0x0, ttl 64, id 0, offset 0, flags [DF], proto TCP (6), length 52, bad cksum 0 (->e4ba)!)
    192.168.106.92.51775 > 192.168.106.92.9042: Flags [.], cksum 0x5630 (incorrect -> 0x2401), seq 1, ack 1, win 6379, options [nop,nop,TS val 1529709869 ecr 1907305218], length 0
E..4..@.@.....j\..j\.?#R-...d]......V0.....
[-.-q.+.
15:51:20.564442 IP (tos 0x0, ttl 64, id 0, offset 0, flags [DF], proto TCP (6), length 52, bad cksum 0 (->e4ba)!)
    192.168.106.92.51775 > 192.168.106.92.9042: Flags [.], cksum 0x5630 (incorrect -> 0x2401), seq 1, ack 1, win 6379, options [nop,nop,TS val 1529709869 ecr 1907305218], length 0
E..4..@.@.....j\..j\.?#R-...d]......V0.....
[-.-q.+.
15:51:20.564455 IP (tos 0x0, ttl 64, id 0, offset 0, flags [DF], proto TCP (6), length 52, bad cksum 0 (->e4ba)!)
    192.168.106.92.9042 > 192.168.106.92.51775: Flags [.], cksum 0x5630 (incorrect -> 0x2401), seq 1, ack 1, win 6379, options [nop,nop,TS val 1907305218 ecr 1529709869], length 0
E..4..@.@.....j\..j\#R.?d]..-.......V0.....
q.+.[-.-
15:51:20.564458 IP (tos 0x0, ttl 64, id 0, offset 0, flags [DF], proto TCP (6), length 52, bad cksum 0 (->e4ba)!)
    192.168.106.92.9042 > 192.168.106.92.51775: Flags [.], cksum 0x5630 (incorrect -> 0x2401), seq 1, ack 1, win 6379, options [nop,nop,TS val 1907305218 ecr 1529709869], length 0
E..4..@.@.....j\..j\#R.?d]..-.......V0.....
q.+.[-.-
15:51:20.565291 IP (tos 0x0, ttl 64, id 0, offset 0, flags [DF], proto TCP (6), length 61, bad cksum 0 (->e4b1)!)
    192.168.106.92.51775 > 192.168.106.92.9042: Flags [P.], cksum 0x5639 (incorrect -> 0xdcee), seq 1:10, ack 1, win 6379, options [nop,nop,TS val 1529709870 ecr 1907305218], length 9
E..=..@.@.....j\..j\.?#R-...d]......V9.....
[-..q.+.B........
15:51:20.565312 IP (tos 0x0, ttl 64, id 0, offset 0, flags [DF], proto TCP (6), length 61, bad cksum 0 (->e4b1)!)
    192.168.106.92.51775 > 192.168.106.92.9042: Flags [P.], cksum 0x5639 (incorrect -> 0xdcee), seq 1:10, ack 1, win 6379, options [nop,nop,TS val 1529709870 ecr 1907305218], length 9
E..=..@.@.....j\..j\.?#R-...d]......V9.....
[-..q.+.B........
15:51:20.565325 IP (tos 0x0, ttl 64, id 0, offset 0, flags [DF], proto TCP (6), length 52, bad cksum 0 (->e4ba)!)
    192.168.106.92.9042 > 192.168.106.92.51775: Flags [.], cksum 0x5630 (incorrect -> 0x23f6), seq 1, ack 10, win 6379, options [nop,nop,TS val 1907305219 ecr 1529709870], length 0
E..4..@.@.....j\..j\#R.?d]..-.......V0.....
q.+.[-..
15:51:20.565335 IP (tos 0x0, ttl 64, id 0, offset 0, flags [DF], proto TCP (6), length 52, bad cksum 0 (->e4ba)!)
    192.168.106.92.9042 > 192.168.106.92.51775: Flags [.], cksum 0x5630 (incorrect -> 0x23f6), seq 1, ack 10, win 6379, options [nop,nop,TS val 1907305219 ecr 1529709870], length 0
E..4..@.@.....j\..j\#R.?d]..-.......V0.....
q.+.[-..
15:51:20.566030 IP (tos 0x0, ttl 64, id 0, offset 0, flags [DF], proto TCP (6), length 165, bad cksum 0 (->e449)!)
    192.168.106.92.9042 > 192.168.106.92.51775: Flags [P.], cksum 0x56a1 (incorrect -> 0x1c3b), seq 1:114, ack 10, win 6379, options [nop,nop,TS val 1907305219 ecr 1529709870], length 113
E.....@.@.....j\..j\#R.?d]..-.......V......
q.+.[-..........h...
.bInvalid or unsupported protocol version (66); supported versions are (3/v3, 4/v4, 5/v5, 6/v6-beta)
15:51:20.566049 IP (tos 0x0, ttl 64, id 0, offset 0, flags [DF], proto TCP (6), length 165, bad cksum 0 (->e449)!)
    192.168.106.92.9042 > 192.168.106.92.51775: Flags [P.], cksum 0x56a1 (incorrect -> 0x1c3b), seq 1:114, ack 10, win 6379, options [nop,nop,TS val 1907305219 ecr 1529709870], length 113
E.....@.@.....j\..j\#R.?d]..-.......V......
q.+.[-..........h...
.bInvalid or unsupported protocol version (66); supported versions are (3/v3, 4/v4, 5/v5, 6/v6-beta)
15:51:20.566061 IP (tos 0x0, ttl 64, id 0, offset 0, flags [DF], proto TCP (6), length 52, bad cksum 0 (->e4ba)!)
    192.168.106.92.51775 > 192.168.106.92.9042: Flags [.], cksum 0x5630 (incorrect -> 0x2387), seq 10, ack 114, win 6377, options [nop,nop,TS val 1529709870 ecr 1907305219], length 0
E..4..@.@.....j\..j\.?#R-...d^.n....V0.....
[-..q.+.
15:51:20.566071 IP (tos 0x0, ttl 64, id 0, offset 0, flags [DF], proto TCP (6), length 52, bad cksum 0 (->e4ba)!)
    192.168.106.92.51775 > 192.168.106.92.9042: Flags [.], cksum 0x5630 (incorrect -> 0x2387), seq 10, ack 114, win 6377, options [nop,nop,TS val 1529709870 ecr 1907305219], length 0
E..4..@.@.....j\..j\.?#R-...d^.n....V0.....
[-..q.+.
15:51:20.566481 IP (tos 0x0, ttl 64, id 0, offset 0, flags [DF], proto TCP (6), length 52, bad cksum 0 (->e4ba)!)
    192.168.106.92.51775 > 192.168.106.92.9042: Flags [F.], cksum 0x5630 (incorrect -> 0x2385), seq 10, ack 114, win 6377, options [nop,nop,TS val 1529709871 ecr 1907305219], length 0
E..4..@.@.....j\..j\.?#R-...d^.n....V0.....
[-./q.+.
15:51:20.566500 IP (tos 0x0, ttl 64, id 0, offset 0, flags [DF], proto TCP (6), length 52, bad cksum 0 (->e4ba)!)
    192.168.106.92.51775 > 192.168.106.92.9042: Flags [F.], cksum 0x5630 (incorrect -> 0x2385), seq 10, ack 114, win 6377, options [nop,nop,TS val 1529709871 ecr 1907305219], length 0
E..4..@.@.....j\..j\.?#R-...d^.n....V0.....
[-./q.+.
15:51:20.566525 IP (tos 0x0, ttl 64, id 0, offset 0, flags [DF], proto TCP (6), length 52, bad cksum 0 (->e4ba)!)
    192.168.106.92.9042 > 192.168.106.92.51775: Flags [.], cksum 0x5630 (incorrect -> 0x2382), seq 114, ack 11, win 6379, options [nop,nop,TS val 1907305220 ecr 1529709871], length 0
E..4..@.@.....j\..j\#R.?d^.n-.......V0.....
q.+.[-./
15:51:20.566532 IP (tos 0x0, ttl 64, id 0, offset 0, flags [DF], proto TCP (6), length 52, bad cksum 0 (->e4ba)!)
    192.168.106.92.9042 > 192.168.106.92.51775: Flags [.], cksum 0x5630 (incorrect -> 0x2382), seq 114, ack 11, win 6379, options [nop,nop,TS val 1907305220 ecr 1529709871], length 0
E..4..@.@.....j\..j\#R.?d^.n-.......V0.....
q.+.[-./
15:51:20.566749 IP (tos 0x0, ttl 64, id 0, offset 0, flags [DF], proto TCP (6), length 64, bad cksum 0 (->e4ae)!)
    192.168.106.92.51776 > 192.168.106.92.9042: Flags [S], cksum 0x563c (incorrect -> 0xc51f), seq 1985571387, win 65535, options [mss 16344,nop,wscale 6,nop,nop,TS val 3047185894 ecr 0,sackOK,eol], length 0
E..@..@.@.....j\..j\.@#RvYj;........V<....?........
..].........
15:51:20.566761 IP (tos 0x0, ttl 64, id 0, offset 0, flags [DF], proto TCP (6), length 64, bad cksum 0 (->e4ae)!)
    192.168.106.92.51776 > 192.168.106.92.9042: Flags [S], cksum 0x563c (incorrect -> 0xc51f), seq 1985571387, win 65535, options [mss 16344,nop,wscale 6,nop,nop,TS val 3047185894 ecr 0,sackOK,eol], length 0
E..@..@.@.....j\..j\.@#RvYj;........V<....?........
..].........
15:51:20.566816 IP (tos 0x0, ttl 64, id 0, offset 0, flags [DF], proto TCP (6), length 64, bad cksum 0 (->e4ae)!)
    192.168.106.92.9042 > 192.168.106.92.51776: Flags [S.], cksum 0x563c (incorrect -> 0x737b), seq 1920212864, ack 1985571388, win 65535, options [mss 16344,nop,wscale 6,nop,nop,TS val 947357479 ecr 3047185894,sackOK,eol], length 0
E..@..@.@.....j\..j\#R.@rt..vYj<....V<....?........
8w.'..].....
15:51:20.566818 IP (tos 0x0, ttl 64, id 0, offset 0, flags [DF], proto TCP (6), length 64, bad cksum 0 (->e4ae)!)
    192.168.106.92.9042 > 192.168.106.92.51776: Flags [S.], cksum 0x563c (incorrect -> 0x737b), seq 1920212864, ack 1985571388, win 65535, options [mss 16344,nop,wscale 6,nop,nop,TS val 947357479 ecr 3047185894,sackOK,eol], length 0
E..@..@.@.....j\..j\#R.@rt..vYj<....V<....?........
8w.'..].....
15:51:20.566828 IP (tos 0x0, ttl 64, id 0, offset 0, flags [DF], proto TCP (6), length 52, bad cksum 0 (->e4ba)!)
    192.168.106.92.51776 > 192.168.106.92.9042: Flags [.], cksum 0x5630 (incorrect -> 0xd484), seq 1, ack 1, win 6379, options [nop,nop,TS val 3047185894 ecr 947357479], length 0
E..4..@.@.....j\..j\.@#RvYj<rt......V0.....
..].8w.'
15:51:20.566829 IP (tos 0x0, ttl 64, id 0, offset 0, flags [DF], proto TCP (6), length 52, bad cksum 0 (->e4ba)!)
    192.168.106.92.51776 > 192.168.106.92.9042: Flags [.], cksum 0x5630 (incorrect -> 0xd484), seq 1, ack 1, win 6379, options [nop,nop,TS val 3047185894 ecr 947357479], length 0
E..4..@.@.....j\..j\.@#RvYj<rt......V0.....
..].8w.'
15:51:20.566834 IP (tos 0x0, ttl 64, id 0, offset 0, flags [DF], proto TCP (6), length 52, bad cksum 0 (->e4ba)!)
    192.168.106.92.9042 > 192.168.106.92.51776: Flags [.], cksum 0x5630 (incorrect -> 0xd484), seq 1, ack 1, win 6379, options [nop,nop,TS val 947357479 ecr 3047185894], length 0
E..4..@.@.....j\..j\#R.@rt..vYj<....V0.....
8w.'..].
15:51:20.566835 IP (tos 0x0, ttl 64, id 0, offset 0, flags [DF], proto TCP (6), length 52, bad cksum 0 (->e4ba)!)
    192.168.106.92.9042 > 192.168.106.92.51776: Flags [.], cksum 0x5630 (incorrect -> 0xd484), seq 1, ack 1, win 6379, options [nop,nop,TS val 947357479 ecr 3047185894], length 0
E..4..@.@.....j\..j\#R.@rt..vYj<....V0.....
8w.'..].
15:51:20.567183 IP (tos 0x0, ttl 64, id 0, offset 0, flags [DF], proto TCP (6), length 52, bad cksum 0 (->e4ba)!)
    192.168.106.92.9042 > 192.168.106.92.51775: Flags [F.], cksum 0x5630 (incorrect -> 0x2381), seq 114, ack 11, win 6379, options [nop,nop,TS val 1907305220 ecr 1529709871], length 0
E..4..@.@.....j\..j\#R.?d^.n-.......V0.....
q.+.[-./
15:51:20.567196 IP (tos 0x0, ttl 64, id 0, offset 0, flags [DF], proto TCP (6), length 52, bad cksum 0 (->e4ba)!)
    192.168.106.92.9042 > 192.168.106.92.51775: Flags [F.], cksum 0x5630 (incorrect -> 0x2381), seq 114, ack 11, win 6379, options [nop,nop,TS val 1907305220 ecr 1529709871], length 0
E..4..@.@.....j\..j\#R.?d^.n-.......V0.....
q.+.[-./
15:51:20.567212 IP (tos 0x0, ttl 64, id 0, offset 0, flags [DF], proto TCP (6), length 52, bad cksum 0 (->e4ba)!)
    192.168.106.92.51775 > 192.168.106.92.9042: Flags [.], cksum 0x5630 (incorrect -> 0x2383), seq 11, ack 115, win 6377, options [nop,nop,TS val 1529709871 ecr 1907305220], length 0
E..4..@.@.....j\..j\.?#R-...d^.o....V0.....
[-./q.+.
15:51:20.567214 IP (tos 0x0, ttl 64, id 0, offset 0, flags [DF], proto TCP (6), length 52, bad cksum 0 (->e4ba)!)
    192.168.106.92.51775 > 192.168.106.92.9042: Flags [.], cksum 0x5630 (incorrect -> 0x2383), seq 11, ack 115, win 6377, options [nop,nop,TS val 1529709871 ecr 1907305220], length 0
E..4..@.@.....j\..j\.?#R-...d^.o....V0.....
[-./q.+.
15:51:20.567525 IP (tos 0x0, ttl 64, id 0, offset 0, flags [DF], proto TCP (6), length 61, bad cksum 0 (->e4b1)!)
    192.168.106.92.51776 > 192.168.106.92.9042: Flags [P.], cksum 0x5639 (incorrect -> 0x8e72), seq 1:10, ack 1, win 6379, options [nop,nop,TS val 3047185895 ecr 947357479], length 9
E..=..@.@.....j\..j\.@#RvYj<rt......V9.....
..].8w.'A........
15:51:20.567538 IP (tos 0x0, ttl 64, id 0, offset 0, flags [DF], proto TCP (6), length 61, bad cksum 0 (->e4b1)!)
    192.168.106.92.51776 > 192.168.106.92.9042: Flags [P.], cksum 0x5639 (incorrect -> 0x8e72), seq 1:10, ack 1, win 6379, options [nop,nop,TS val 3047185895 ecr 947357479], length 9
E..=..@.@.....j\..j\.@#RvYj<rt......V9.....
..].8w.'A........
15:51:20.567545 IP (tos 0x0, ttl 64, id 0, offset 0, flags [DF], proto TCP (6), length 52, bad cksum 0 (->e4ba)!)
    192.168.106.92.9042 > 192.168.106.92.51776: Flags [.], cksum 0x5630 (incorrect -> 0xd479), seq 1, ack 10, win 6379, options [nop,nop,TS val 947357480 ecr 3047185895], length 0
E..4..@.@.....j\..j\#R.@rt..vYjE....V0.....
8w.(..].
15:51:20.567551 IP (tos 0x0, ttl 64, id 0, offset 0, flags [DF], proto TCP (6), length 52, bad cksum 0 (->e4ba)!)
    192.168.106.92.9042 > 192.168.106.92.51776: Flags [.], cksum 0x5630 (incorrect -> 0xd479), seq 1, ack 10, win 6379, options [nop,nop,TS val 947357480 ecr 3047185895], length 0
E..4..@.@.....j\..j\#R.@rt..vYjE....V0.....
8w.(..].
15:51:20.568275 IP (tos 0x0, ttl 64, id 0, offset 0, flags [DF], proto TCP (6), length 165, bad cksum 0 (->e449)!)
    192.168.106.92.9042 > 192.168.106.92.51776: Flags [P.], cksum 0x56a1 (incorrect -> 0xccbf), seq 1:114, ack 10, win 6379, options [nop,nop,TS val 947357480 ecr 3047185895], length 113
E.....@.@.....j\..j\#R.@rt..vYjE....V......
8w.(..].........h...
.bInvalid or unsupported protocol version (65); supported versions are (3/v3, 4/v4, 5/v5, 6/v6-beta)
15:51:20.568288 IP (tos 0x0, ttl 64, id 0, offset 0, flags [DF], proto TCP (6), length 165, bad cksum 0 (->e449)!)
    192.168.106.92.9042 > 192.168.106.92.51776: Flags [P.], cksum 0x56a1 (incorrect -> 0xccbf), seq 1:114, ack 10, win 6379, options [nop,nop,TS val 947357480 ecr 3047185895], length 113
E.....@.@.....j\..j\#R.@rt..vYjE....V......
8w.(..].........h...
.bInvalid or unsupported protocol version (65); supported versions are (3/v3, 4/v4, 5/v5, 6/v6-beta)
15:51:20.568295 IP (tos 0x0, ttl 64, id 0, offset 0, flags [DF], proto TCP (6), length 52, bad cksum 0 (->e4ba)!)
    192.168.106.92.51776 > 192.168.106.92.9042: Flags [.], cksum 0x5630 (incorrect -> 0xd40a), seq 10, ack 114, win 6377, options [nop,nop,TS val 3047185895 ecr 947357480], length 0
E..4..@.@.....j\..j\.@#RvYjErt......V0.....
..].8w.(
15:51:20.568302 IP (tos 0x0, ttl 64, id 0, offset 0, flags [DF], proto TCP (6), length 52, bad cksum 0 (->e4ba)!)
    192.168.106.92.51776 > 192.168.106.92.9042: Flags [.], cksum 0x5630 (incorrect -> 0xd40a), seq 10, ack 114, win 6377, options [nop,nop,TS val 3047185895 ecr 947357480], length 0
E..4..@.@.....j\..j\.@#RvYjErt......V0.....
..].8w.(
15:51:20.568635 IP (tos 0x0, ttl 64, id 0, offset 0, flags [DF], proto TCP (6), length 52, bad cksum 0 (->e4ba)!)
    192.168.106.92.51776 > 192.168.106.92.9042: Flags [F.], cksum 0x5630 (incorrect -> 0xd408), seq 10, ack 114, win 6377, options [nop,nop,TS val 3047185896 ecr 947357480], length 0
E..4..@.@.....j\..j\.@#RvYjErt......V0.....
..].8w.(
15:51:20.568648 IP (tos 0x0, ttl 64, id 0, offset 0, flags [DF], proto TCP (6), length 52, bad cksum 0 (->e4ba)!)
    192.168.106.92.51776 > 192.168.106.92.9042: Flags [F.], cksum 0x5630 (incorrect -> 0xd408), seq 10, ack 114, win 6377, options [nop,nop,TS val 3047185896 ecr 947357480], length 0
E..4..@.@.....j\..j\.@#RvYjErt......V0.....
..].8w.(
15:51:20.568659 IP (tos 0x0, ttl 64, id 0, offset 0, flags [DF], proto TCP (6), length 52, bad cksum 0 (->e4ba)!)
    192.168.106.92.9042 > 192.168.106.92.51776: Flags [.], cksum 0x5630 (incorrect -> 0xd405), seq 114, ack 11, win 6379, options [nop,nop,TS val 947357481 ecr 3047185896], length 0
E..4..@.@.....j\..j\#R.@rt..vYjF....V0.....
8w.)..].
15:51:20.568661 IP (tos 0x0, ttl 64, id 0, offset 0, flags [DF], proto TCP (6), length 52, bad cksum 0 (->e4ba)!)
    192.168.106.92.9042 > 192.168.106.92.51776: Flags [.], cksum 0x5630 (incorrect -> 0xd405), seq 114, ack 11, win 6379, options [nop,nop,TS val 947357481 ecr 3047185896], length 0
E..4..@.@.....j\..j\#R.@rt..vYjF....V0.....
8w.)..].
15:51:20.568912 IP (tos 0x0, ttl 64, id 0, offset 0, flags [DF], proto TCP (6), length 64, bad cksum 0 (->e4ae)!)
    192.168.106.92.51777 > 192.168.106.92.9042: Flags [S], cksum 0x563c (incorrect -> 0x730f), seq 3218753763, win 65535, options [mss 16344,nop,wscale 6,nop,nop,TS val 3234495650 ecr 0,sackOK,eol], length 0
E..@..@.@.....j\..j\.A#R..H.........V<....?........
..|.........
15:51:20.568924 IP (tos 0x0, ttl 64, id 0, offset 0, flags [DF], proto TCP (6), length 64, bad cksum 0 (->e4ae)!)
    192.168.106.92.51777 > 192.168.106.92.9042: Flags [S], cksum 0x563c (incorrect -> 0x730f), seq 3218753763, win 65535, options [mss 16344,nop,wscale 6,nop,nop,TS val 3234495650 ecr 0,sackOK,eol], length 0
E..@..@.@.....j\..j\.A#R..H.........V<....?........
..|.........
15:51:20.568970 IP (tos 0x0, ttl 64, id 0, offset 0, flags [DF], proto TCP (6), length 64, bad cksum 0 (->e4ae)!)
    192.168.106.92.9042 > 192.168.106.92.51777: Flags [S.], cksum 0x563c (incorrect -> 0x55ff), seq 3967159220, ack 3218753764, win 65535, options [mss 16344,nop,wscale 6,nop,nop,TS val 822604748 ecr 3234495650,sackOK,eol], length 0
E..@..@.@.....j\..j\#R.A.v....H.....V<....?........
1.....|.....
15:51:20.568972 IP (tos 0x0, ttl 64, id 0, offset 0, flags [DF], proto TCP (6), length 64, bad cksum 0 (->e4ae)!)
    192.168.106.92.9042 > 192.168.106.92.51777: Flags [S.], cksum 0x563c (incorrect -> 0x55ff), seq 3967159220, ack 3218753764, win 65535, options [mss 16344,nop,wscale 6,nop,nop,TS val 822604748 ecr 3234495650,sackOK,eol], length 0
E..@..@.@.....j\..j\#R.A.v....H.....V<....?........
1.....|.....
15:51:20.568980 IP (tos 0x0, ttl 64, id 0, offset 0, flags [DF], proto TCP (6), length 52, bad cksum 0 (->e4ba)!)
    192.168.106.92.51777 > 192.168.106.92.9042: Flags [.], cksum 0x5630 (incorrect -> 0xb708), seq 1, ack 1, win 6379, options [nop,nop,TS val 3234495650 ecr 822604748], length 0
E..4..@.@.....j\..j\.A#R..H..v......V0.....
..|.1...
15:51:20.568981 IP (tos 0x0, ttl 64, id 0, offset 0, flags [DF], proto TCP (6), length 52, bad cksum 0 (->e4ba)!)
    192.168.106.92.51777 > 192.168.106.92.9042: Flags [.], cksum 0x5630 (incorrect -> 0xb708), seq 1, ack 1, win 6379, options [nop,nop,TS val 3234495650 ecr 822604748], length 0
E..4..@.@.....j\..j\.A#R..H..v......V0.....
..|.1...
15:51:20.568989 IP (tos 0x0, ttl 64, id 0, offset 0, flags [DF], proto TCP (6), length 52, bad cksum 0 (->e4ba)!)
    192.168.106.92.9042 > 192.168.106.92.51777: Flags [.], cksum 0x5630 (incorrect -> 0xb708), seq 1, ack 1, win 6379, options [nop,nop,TS val 822604748 ecr 3234495650], length 0
E..4..@.@.....j\..j\#R.A.v....H.....V0.....
1.....|.
15:51:20.568990 IP (tos 0x0, ttl 64, id 0, offset 0, flags [DF], proto TCP (6), length 52, bad cksum 0 (->e4ba)!)
    192.168.106.92.9042 > 192.168.106.92.51777: Flags [.], cksum 0x5630 (incorrect -> 0xb708), seq 1, ack 1, win 6379, options [nop,nop,TS val 822604748 ecr 3234495650], length 0
E..4..@.@.....j\..j\#R.A.v....H.....V0.....
1.....|.
15:51:20.569159 IP (tos 0x0, ttl 64, id 0, offset 0, flags [DF], proto TCP (6), length 52, bad cksum 0 (->e4ba)!)
    192.168.106.92.9042 > 192.168.106.92.51776: Flags [F.], cksum 0x5630 (incorrect -> 0xd404), seq 114, ack 11, win 6379, options [nop,nop,TS val 947357481 ecr 3047185896], length 0
E..4..@.@.....j\..j\#R.@rt..vYjF....V0.....
8w.)..].
15:51:20.569171 IP (tos 0x0, ttl 64, id 0, offset 0, flags [DF], proto TCP (6), length 52, bad cksum 0 (->e4ba)!)
    192.168.106.92.9042 > 192.168.106.92.51776: Flags [F.], cksum 0x5630 (incorrect -> 0xd404), seq 114, ack 11, win 6379, options [nop,nop,TS val 947357481 ecr 3047185896], length 0
E..4..@.@.....j\..j\#R.@rt..vYjF....V0.....
8w.)..].
15:51:20.569185 IP (tos 0x0, ttl 64, id 0, offset 0, flags [DF], proto TCP (6), length 52, bad cksum 0 (->e4ba)!)
    192.168.106.92.51776 > 192.168.106.92.9042: Flags [.], cksum 0x5630 (incorrect -> 0xd406), seq 11, ack 115, win 6377, options [nop,nop,TS val 3047185896 ecr 947357481], length 0
E..4..@.@.....j\..j\.@#RvYjFrt......V0.....
..].8w.)
15:51:20.569188 IP (tos 0x0, ttl 64, id 0, offset 0, flags [DF], proto TCP (6), length 52, bad cksum 0 (->e4ba)!)
    192.168.106.92.51776 > 192.168.106.92.9042: Flags [.], cksum 0x5630 (incorrect -> 0xd406), seq 11, ack 115, win 6377, options [nop,nop,TS val 3047185896 ecr 947357481], length 0
E..4..@.@.....j\..j\.@#RvYjFrt......V0.....
..].8w.)
15:51:20.569461 IP (tos 0x0, ttl 64, id 0, offset 0, flags [DF], proto TCP (6), length 61, bad cksum 0 (->e4b1)!)
    192.168.106.92.51777 > 192.168.106.92.9042: Flags [P.], cksum 0x5639 (incorrect -> 0xacf7), seq 1:10, ack 1, win 6379, options [nop,nop,TS val 3234495650 ecr 822604748], length 9
E..=..@.@.....j\..j\.A#R..H..v......V9.....
..|.1............
15:51:20.569473 IP (tos 0x0, ttl 64, id 0, offset 0, flags [DF], proto TCP (6), length 61, bad cksum 0 (->e4b1)!)
    192.168.106.92.51777 > 192.168.106.92.9042: Flags [P.], cksum 0x5639 (incorrect -> 0xacf7), seq 1:10, ack 1, win 6379, options [nop,nop,TS val 3234495650 ecr 822604748], length 9
E..=..@.@.....j\..j\.A#R..H..v......V9.....
..|.1............
15:51:20.569480 IP (tos 0x0, ttl 64, id 0, offset 0, flags [DF], proto TCP (6), length 52, bad cksum 0 (->e4ba)!)
    192.168.106.92.9042 > 192.168.106.92.51777: Flags [.], cksum 0x5630 (incorrect -> 0xb6ff), seq 1, ack 10, win 6379, options [nop,nop,TS val 822604748 ecr 3234495650], length 0
E..4..@.@.....j\..j\#R.A.v....H.....V0.....
1.....|.
15:51:20.569485 IP (tos 0x0, ttl 64, id 0, offset 0, flags [DF], proto TCP (6), length 52, bad cksum 0 (->e4ba)!)
    192.168.106.92.9042 > 192.168.106.92.51777: Flags [.], cksum 0x5630 (incorrect -> 0xb6ff), seq 1, ack 10, win 6379, options [nop,nop,TS val 822604748 ecr 3234495650], length 0
E..4..@.@.....j\..j\#R.A.v....H.....V0.....
1.....|.
15:51:20.570233 IP (tos 0x0, ttl 64, id 0, offset 0, flags [DF], proto TCP (6), length 163, bad cksum 0 (->e44b)!)
    192.168.106.92.9042 > 192.168.106.92.51777: Flags [P.], cksum 0x569f (incorrect -> 0xe04e), seq 1:112, ack 10, win 6379, options [nop,nop,TS val 822604750 ecr 3234495650], length 111
E.....@.@.....j\..j\#R.A.v....H.....V......
1.....|.........f....PROTOCOL_VERSIONS....3/v3..4/v4..5/v5.	6/v6-beta..COMPRESSION....snappy..lz4..CQL_VERSION....3.4.7
15:51:20.570247 IP (tos 0x0, ttl 64, id 0, offset 0, flags [DF], proto TCP (6), length 163, bad cksum 0 (->e44b)!)
    192.168.106.92.9042 > 192.168.106.92.51777: Flags [P.], cksum 0x569f (incorrect -> 0xe04e), seq 1:112, ack 10, win 6379, options [nop,nop,TS val 822604750 ecr 3234495650], length 111
E.....@.@.....j\..j\#R.A.v....H.....V......
1.....|.........f....PROTOCOL_VERSIONS....3/v3..4/v4..5/v5.	6/v6-beta..COMPRESSION....snappy..lz4..CQL_VERSION....3.4.7
15:51:20.570255 IP (tos 0x0, ttl 64, id 0, offset 0, flags [DF], proto TCP (6), length 52, bad cksum 0 (->e4ba)!)
    192.168.106.92.51777 > 192.168.106.92.9042: Flags [.], cksum 0x5630 (incorrect -> 0xb68e), seq 10, ack 112, win 6377, options [nop,nop,TS val 3234495652 ecr 822604750], length 0
E..4..@.@.....j\..j\.A#R..H..v.$....V0.....
..|.1...
15:51:20.570258 IP (tos 0x0, ttl 64, id 0, offset 0, flags [DF], proto TCP (6), length 52, bad cksum 0 (->e4ba)!)
    192.168.106.92.51777 > 192.168.106.92.9042: Flags [.], cksum 0x5630 (incorrect -> 0xb68e), seq 10, ack 112, win 6377, options [nop,nop,TS val 3234495652 ecr 822604750], length 0
E..4..@.@.....j\..j\.A#R..H..v.$....V0.....
..|.1...
15:51:20.570571 IP (tos 0x0, ttl 64, id 0, offset 0, flags [DF], proto TCP (6), length 144, bad cksum 0 (->e45e)!)
    192.168.106.92.51777 > 192.168.106.92.9042: Flags [P.], cksum 0x568c (incorrect -> 0xe7d2), seq 10:102, ack 112, win 6377, options [nop,nop,TS val 3234495652 ecr 822604750], length 92
E.....@.@.....j\..j\.A#R..H..v.$....V......
..|.1...........S....DRIVER_NAME..DataStax Python Driver..DRIVER_VERSION..3.29.0..CQL_VERSION..3.4.7
15:51:20.570590 IP (tos 0x0, ttl 64, id 0, offset 0, flags [DF], proto TCP (6), length 144, bad cksum 0 (->e45e)!)
    192.168.106.92.51777 > 192.168.106.92.9042: Flags [P.], cksum 0x568c (incorrect -> 0xe7d2), seq 10:102, ack 112, win 6377, options [nop,nop,TS val 3234495652 ecr 822604750], length 92
E.....@.@.....j\..j\.A#R..H..v.$....V......
..|.1...........S....DRIVER_NAME..DataStax Python Driver..DRIVER_VERSION..3.29.0..CQL_VERSION..3.4.7
15:51:20.570603 IP (tos 0x0, ttl 64, id 0, offset 0, flags [DF], proto TCP (6), length 52, bad cksum 0 (->e4ba)!)
    192.168.106.92.9042 > 192.168.106.92.51777: Flags [.], cksum 0x5630 (incorrect -> 0xb631), seq 112, ack 102, win 6378, options [nop,nop,TS val 822604750 ecr 3234495652], length 0
E..4..@.@.....j\..j\#R.A.v.$..II....V0.....
1.....|.
15:51:20.570613 IP (tos 0x0, ttl 64, id 0, offset 0, flags [DF], proto TCP (6), length 52, bad cksum 0 (->e4ba)!)
    192.168.106.92.9042 > 192.168.106.92.51777: Flags [.], cksum 0x5630 (incorrect -> 0xb631), seq 112, ack 102, win 6378, options [nop,nop,TS val 822604750 ecr 3234495652], length 0
E..4..@.@.....j\..j\#R.A.v.$..II....V0.....
1.....|.
15:51:20.571366 IP (tos 0x0, ttl 64, id 0, offset 0, flags [DF], proto TCP (6), length 110, bad cksum 0 (->e480)!)
    192.168.106.92.9042 > 192.168.106.92.51777: Flags [P.], cksum 0x566a (incorrect -> 0xc273), seq 112:170, ack 102, win 6378, options [nop,nop,TS val 822604751 ecr 3234495652], length 58
E..n..@.@.....j\..j\#R.A.v.$..II....Vj.....
1.....|.........1./org.apache.cassandra.auth.PasswordAuthenticator
15:51:20.571385 IP (tos 0x0, ttl 64, id 0, offset 0, flags [DF], proto TCP (6), length 110, bad cksum 0 (->e480)!)
    192.168.106.92.9042 > 192.168.106.92.51777: Flags [P.], cksum 0x566a (incorrect -> 0xc273), seq 112:170, ack 102, win 6378, options [nop,nop,TS val 822604751 ecr 3234495652], length 58
E..n..@.@.....j\..j\#R.A.v.$..II....Vj.....
1.....|.........1./org.apache.cassandra.auth.PasswordAuthenticator
15:51:20.571396 IP (tos 0x0, ttl 64, id 0, offset 0, flags [DF], proto TCP (6), length 52, bad cksum 0 (->e4ba)!)
    192.168.106.92.51777 > 192.168.106.92.9042: Flags [.], cksum 0x5630 (incorrect -> 0xb5f6), seq 102, ack 170, win 6377, options [nop,nop,TS val 3234495653 ecr 822604751], length 0
E..4..@.@.....j\..j\.A#R..II.v.^....V0.....
..|.1...
15:51:20.571407 IP (tos 0x0, ttl 64, id 0, offset 0, flags [DF], proto TCP (6), length 52, bad cksum 0 (->e4ba)!)
    192.168.106.92.51777 > 192.168.106.92.9042: Flags [.], cksum 0x5630 (incorrect -> 0xb5f6), seq 102, ack 170, win 6377, options [nop,nop,TS val 3234495653 ecr 822604751], length 0
E..4..@.@.....j\..j\.A#R..II.v.^....V0.....
..|.1...
15:51:20.571698 IP (tos 0x0, ttl 64, id 0, offset 0, flags [DF], proto TCP (6), length 97, bad cksum 0 (->e48d)!)
    192.168.106.92.51777 > 192.168.106.92.9042: Flags [P.], cksum 0x565d (incorrect -> 0xfa46), seq 102:147, ack 170, win 6377, options [nop,nop,TS val 3234495653 ecr 822604751], length 45
E..a..@.@.....j\..j\.A#R..II.v.^....V].....
..|.1...#....]..............user_rayan.pass_rayan....
15:51:20.571721 IP (tos 0x0, ttl 64, id 0, offset 0, flags [DF], proto TCP (6), length 97, bad cksum 0 (->e48d)!)
    192.168.106.92.51777 > 192.168.106.92.9042: Flags [P.], cksum 0x565d (incorrect -> 0xfa46), seq 102:147, ack 170, win 6377, options [nop,nop,TS val 3234495653 ecr 822604751], length 45
E..a..@.@.....j\..j\.A#R..II.v.^....V].....
..|.1...#....]..............user_rayan.pass_rayan....
15:51:20.571732 IP (tos 0x0, ttl 64, id 0, offset 0, flags [DF], proto TCP (6), length 52, bad cksum 0 (->e4ba)!)
    192.168.106.92.9042 > 192.168.106.92.51777: Flags [.], cksum 0x5630 (incorrect -> 0xb5c9), seq 170, ack 147, win 6377, options [nop,nop,TS val 822604751 ecr 3234495653], length 0
E..4..@.@.....j\..j\#R.A.v.^..Iv....V0.....
1.....|.
15:51:20.571741 IP (tos 0x0, ttl 64, id 0, offset 0, flags [DF], proto TCP (6), length 52, bad cksum 0 (->e4ba)!)
    192.168.106.92.9042 > 192.168.106.92.51777: Flags [.], cksum 0x5630 (incorrect -> 0xb5c9), seq 170, ack 147, win 6377, options [nop,nop,TS val 822604751 ecr 3234495653], length 0
E..4..@.@.....j\..j\#R.A.v.^..Iv....V0.....
1.....|.
15:51:20.573223 IP (tos 0x0, ttl 64, id 0, offset 0, flags [DF], proto TCP (6), length 135, bad cksum 0 (->e467)!)
    192.168.106.92.9042 > 192.168.106.92.51777: Flags [P.], cksum 0x5683 (incorrect -> 0x4954), seq 170:253, ack 147, win 6377, options [nop,nop,TS val 822604753 ecr 3234495653], length 83
E.....@.@.....j\..j\#R.A.v.^..Iv....V......
1.....|.I.............@.....:Provided username user_rayan and/or password are incorrectg.i.
15:51:20.573244 IP (tos 0x0, ttl 64, id 0, offset 0, flags [DF], proto TCP (6), length 135, bad cksum 0 (->e467)!)
    192.168.106.92.9042 > 192.168.106.92.51777: Flags [P.], cksum 0x5683 (incorrect -> 0x4954), seq 170:253, ack 147, win 6377, options [nop,nop,TS val 822604753 ecr 3234495653], length 83
E.....@.@.....j\..j\#R.A.v.^..Iv....V......
1.....|.I.............@.....:Provided username user_rayan and/or password are incorrectg.i.
15:51:20.573255 IP (tos 0x0, ttl 64, id 0, offset 0, flags [DF], proto TCP (6), length 52, bad cksum 0 (->e4ba)!)
    192.168.106.92.51777 > 192.168.106.92.9042: Flags [.], cksum 0x5630 (incorrect -> 0xb574), seq 147, ack 253, win 6375, options [nop,nop,TS val 3234495655 ecr 822604753], length 0
E..4..@.@.....j\..j\.A#R..Iv.v......V0.....
..|.1...
15:51:20.573265 IP (tos 0x0, ttl 64, id 0, offset 0, flags [DF], proto TCP (6), length 52, bad cksum 0 (->e4ba)!)
    192.168.106.92.51777 > 192.168.106.92.9042: Flags [.], cksum 0x5630 (incorrect -> 0xb574), seq 147, ack 253, win 6375, options [nop,nop,TS val 3234495655 ecr 822604753], length 0
E..4..@.@.....j\..j\.A#R..Iv.v......V0.....
..|.1...
15:51:20.573806 IP (tos 0x0, ttl 64, id 0, offset 0, flags [DF], proto TCP (6), length 52, bad cksum 0 (->e4ba)!)
    192.168.106.92.51777 > 192.168.106.92.9042: Flags [F.], cksum 0x5630 (incorrect -> 0xb573), seq 147, ack 253, win 6375, options [nop,nop,TS val 3234495655 ecr 822604753], length 0
E..4..@.@.....j\..j\.A#R..Iv.v......V0.....
..|.1...
15:51:20.573817 IP (tos 0x0, ttl 64, id 0, offset 0, flags [DF], proto TCP (6), length 52, bad cksum 0 (->e4ba)!)
    192.168.106.92.51777 > 192.168.106.92.9042: Flags [F.], cksum 0x5630 (incorrect -> 0xb573), seq 147, ack 253, win 6375, options [nop,nop,TS val 3234495655 ecr 822604753], length 0
E..4..@.@.....j\..j\.A#R..Iv.v......V0.....
..|.1...
15:51:20.573830 IP (tos 0x0, ttl 64, id 0, offset 0, flags [DF], proto TCP (6), length 52, bad cksum 0 (->e4ba)!)
    192.168.106.92.9042 > 192.168.106.92.51777: Flags [.], cksum 0x5630 (incorrect -> 0xb571), seq 253, ack 148, win 6377, options [nop,nop,TS val 822604753 ecr 3234495655], length 0
E..4..@.@.....j\..j\#R.A.v....Iw....V0.....
1.....|.
15:51:20.573832 IP (tos 0x0, ttl 64, id 0, offset 0, flags [DF], proto TCP (6), length 52, bad cksum 0 (->e4ba)!)
    192.168.106.92.9042 > 192.168.106.92.51777: Flags [.], cksum 0x5630 (incorrect -> 0xb571), seq 253, ack 148, win 6377, options [nop,nop,TS val 822604753 ecr 3234495655], length 0
E..4..@.@.....j\..j\#R.A.v....Iw....V0.....
1.....|.
15:51:20.574502 IP (tos 0x0, ttl 64, id 0, offset 0, flags [DF], proto TCP (6), length 52, bad cksum 0 (->e4ba)!)
    192.168.106.92.9042 > 192.168.106.92.51777: Flags [F.], cksum 0x5630 (incorrect -> 0xb56f), seq 253, ack 148, win 6377, options [nop,nop,TS val 822604754 ecr 3234495655], length 0
E..4..@.@.....j\..j\#R.A.v....Iw....V0.....
1.....|.
15:51:20.574521 IP (tos 0x0, ttl 64, id 0, offset 0, flags [DF], proto TCP (6), length 52, bad cksum 0 (->e4ba)!)
    192.168.106.92.9042 > 192.168.106.92.51777: Flags [F.], cksum 0x5630 (incorrect -> 0xb56f), seq 253, ack 148, win 6377, options [nop,nop,TS val 822604754 ecr 3234495655], length 0
E..4..@.@.....j\..j\#R.A.v....Iw....V0.....
1.....|.
15:51:20.574553 IP (tos 0x0, ttl 64, id 0, offset 0, flags [DF], proto TCP (6), length 52, bad cksum 0 (->e4ba)!)
    192.168.106.92.51777 > 192.168.106.92.9042: Flags [.], cksum 0x5630 (incorrect -> 0xb570), seq 148, ack 254, win 6375, options [nop,nop,TS val 3234495656 ecr 822604754], length 0
E..4..@.@.....j\..j\.A#R..Iw.v......V0.....
..|.1...
15:51:20.574557 IP (tos 0x0, ttl 64, id 0, offset 0, flags [DF], proto TCP (6), length 52, bad cksum 0 (->e4ba)!)
    192.168.106.92.51777 > 192.168.106.92.9042: Flags [.], cksum 0x5630 (incorrect -> 0xb570), seq 148, ack 254, win 6375, options [nop,nop,TS val 3234495656 ecr 822604754], length 0
E..4..@.@.....j\..j\.A#R..Iw.v......V0.....
..|.1...
